Title,Date,Image URL,Likes Count
Taylor Swift's Spectacular Tour Sparks Unprecedented Hotel Booking Surge in Buenos Aires,"November 23, 2023",https://rategaincom.wpenginepowered.com/wp-content/uploads/2023/11/swiftie-effect-buenos-aires-scaled.jpg,9 likes
A Complete Guide to Hotel Revenue Management,"November 22, 2023",https://rategaincom.wpenginepowered.com/wp-content/uploads/2023/11/A-Complete-Guide-to-Hotel-Revenue-Management.png,8 likes
The Ultimate Guide to Choosing the Right Hotel Booking Engine,"November 22, 2023",https://rategaincom.wpenginepowered.com/wp-content/uploads/2023/11/The-Ultimate-Guide-to-Choosing-the-Right-Hotel-Booking-Engine.png,4 likes
"Maximize Your Hotel’s Exposure with Google AdSense’s New ""Related Search"" Feature in Auto Ads","October 20, 2023",https://rategaincom.wpenginepowered.com/wp-content/uploads/2023/10/Google-AdSenses-New-Related-Search-Feature-in-Auto-Ads.png,33 likes
Beyond Reach & Frequency: Hotels' New Era with Facebook's 'Reservation' Buying Type,"October 12, 2023",https://rategaincom.wpenginepowered.com/wp-content/uploads/2023/10/Transforming-with-Facebooks-Reservation-BUYING-Strategy.png,17 likes
Managing Overbookings and Cancellations with Hotel Booking Engines,"October 5, 2023",https://rategaincom.wpenginepowered.com/wp-content/uploads/2023/10/Overbookings-Cancellations-Not-a-Problem-with-Modern-Hotel-Booking-Engines.png,12 likes
Global Distribution System (GDS) vs. Channel Manager: Which is Right for Your Hotel,"October 1, 2023",https://rategaincom.wpenginepowered.com/wp-content/uploads/2023/10/Hotel-Distribution-Done-Right-Choosing-between-GDS-and-Channel-Manager.png,12 likes
Jingle All the Way: Europe Christmas Travel Trends,"September 28, 2023",https://rategaincom.wpenginepowered.com/wp-content/uploads/2023/10/Europe-Christmas-Travel-Trends.jpg,8 likes
Why Bing Hotel Ads Should Be in Your Marketing Mix,"September 28, 2023",https://rategaincom.wpenginepowered.com/wp-content/uploads/2023/09/Bing-Hotel-Ads-Your-Hotels-Secret-Revenue-Booster.png,9 likes
